Image,Vietnamese,Target word,Transcription,Example
"<img src=""yellow-pages.jpg"" />","danh mục, danh bạ, danh bạ điện thoại; sách chỉ dẫn/hướng dẫn",directory,/dɪˈrektəri/,"<div>a. We consulted the directory to see where the train station was located.</div><div>b. By calling directory assistance, Mr. Scannel was able to get the phone number for&nbsp;the train station.</div><div><br /></div>"
"<img src=""ER-time duration.jpg"" />",khoảng thời gian,duration,/djʊˈreɪʃn̩/,"<div>a. Mother lent me her spare jacket for the duration of the trip.</div><div>b. Despite our personal differences, my roommate and I agreed to be as pleasant as&nbsp;possible for the duration of the train ride.</div><div><br /></div>"
"<img src=""images876767_5h0rrpnf.jpg"" />","<div>cho phép làm cái gì, cho phép có cái gì</div><div>→ (dạng bị động) có quyền được làm cái gì, có quyền được có cái&nbsp;gì</div>",entitle,/ɪnˈtaɪtl̩/,"<div>a. During the holiday rush, a train ticket entitled the passenger to a ride, but not&nbsp;necessarily a seat.</div><div>b. The mess the train line made of Pedro's sleeping room reservations entitle him to a&nbsp;free upgrade to a better room.</div><div><br /></div>"
"<img src=""dublin-bus-fare-increase-390x285.jpg"" />","tiền xe, tiền vé (tàu, xe..)",fare,/feə/,<div>a. The train fare has increased since I rode last.</div><div>b. Pay your fare at the ticket office and you will get a ticket to board the train.</div><div><br /></div>
"<img src=""6d294495.jpg"" />","bù lại, bù đắp, đền bù; in ốp-sét;",offset,/ˈɒfset/,"<div>a. The high cost of the hotel room offset the savings we made by taking the train&nbsp;instead of the plane.</div><div>b. By reducing her transportation costs once in the United States, Mrs. Sato offset the&nbsp;cost of getting to this country.</div><div><br /></div>"
"<img src=""paste-67899137982467.jpg"" />","<div>hoạt động, chạy (máy); thao tác, thực hiện, tiến hành, triển&nbsp;khai...&nbsp;</div>",operate,/ˈɒpəreɪt/,<div>a. The train operates on a punctual schedule.</div><div>b. The train only operates in this area at the height of the tourist season.</div><div><br /></div>
"<img src=""a1.jpg"" />","đúng giờ, không chậm trễ;",punctual,/ˈpʌŋktʃʊəl/,<div>a. Please be on time; the train leaves punctually at noon.</div><div>b. The train usually arrives punctually; I can't imagine what is delaying it today.</div><div><br /></div>
"<img src=""e-=-m-c-2-thuyen-tuong-doi.jpg"" />","tương đối, vừa phải, hơi; có quan hệ với, có liên quan;",relatively,/ˈrelətɪvli/,<div>a. The train is relatively empty for this time of day.</div><div>b. The train station has been relatively busy for a weekday.</div><div><br /></div>
"<img src=""edf4d286-82db-4cbc-8f9d-29a68541795f.jpg"" />","phần còn lại, chỗ còn lại; số dư, phần dư (toán học);",remainder,/rɪˈmeɪndə/,"<div>a. The Alaskan frontier has train service in the summer, but for the remainder of the&nbsp;year the tracks are impassable.</div><div>b. We will move you to a less expensive room and credit the remainder of what&nbsp;you've already paid to your charge card.</div><div><br /></div>"
"<img src=""paste-99677601005571.jpg"" />","xa, xa xôi, xa xăm; xa cách, hẻo lánh, cách biệt;",remote,/rɪˈməʊt/,<div>a. I was surprised to find train service to such a remote location.</div><div>b. We took the train out of the city and found a remote hotel in the country for the&nbsp;weekend.</div><div><br /></div>
"<img src=""khan-cau-55x65-1113.psd_-844x1024_1380643440871.jpg"" />","sự hấp dẫn, sức lôi cuốn;",appeal,/əˈpiːl/,<div><div>a. It's a programme designed to appeal mainly to 16 to 25-year-olds.</div><div>b. I think what appeals to me about his painting is his use of colour.</div></div><div><br /></div>
"<img src=""139402131733365685227594.jpg"" />","tiên tiến, tiến bộ, cấp tiến; cấp cao, ở mức cao",advanced&nbsp;,/əd'vɑ:nst/,"<div>a. Since the hotel installed an advanced computer system, all operations have been&nbsp;functioning more smoothly.</div><div>b. Pablo has been promoted to assistant manager and he is happy with his advanced&nbsp;position.</div><div><br /></div>"
"<img src=""chain.jpg"" />","dây xích, dây chuyền, dãy, chuỗi, loạt (khách sạn, nhà hàng...)",chain,/tʃeɪn/,<div>a. Budget-priced hotel chains have made a huge impact in the industry.</div><div>b. The hotel being built in Seoul is the newest one in the chain.</div><div><br /></div>
"<img src=""RE_firstclass_checkin_felix_3770_tcm233-366624.jpg"" />","làm thủ tục đăng ký (để vào khách sạn, vào hội nghị, lên máy bay...)",check in,/tʃek ɪn/,"<div>a.Patrons check in at the hotel immediately upon their arrival.</div><div>b.To know that the conference guests have arrived, we ask them to check in at the&nbsp;registration desk.</div>"
"<img src=""expect_1380643440871.jpg"" />","mong chờ, mong đợi, hy vọng; đòi hỏi; cho rằng, nghĩ rằng;",expect,/ɪkˈspekt/,"<div>a. You can expect a clean room when you check in at a hotel.</div><div>b. Mr. Kim expected that the bed linens would be changed daily.</div><div>If you say that a woman is expecting, you mean that she is pregnant.</div><div><br /></div>"
"<img src=""housekeeper.jpg"" />","bà quản gia; người coi nhà, người giữ nhà;&nbsp;<div>nhân viên trực buồng/dọn phòng;</div>",housekeeper,/ˈhaʊsˌkiːpə/,<div>a. Eloise's first job at the hotel was as a housekeeper and now she is the manager.</div><div>b. The desk clerk is sending the housekeeper to bring more towels to your room.</div><div><br /></div>
"<img src=""Notify-and-Remind.jpg"" />","báo, thông báo, khai báo, cho biết;",notify,/ˈnəʊtɪfaɪ/,<div>a. They notified the hotel that they had been delayed in traffic and would be arriving&nbsp;late.</div><div>b. Lydia notified the hotel in writing that she was canceling her reservation.</div><div><br /></div>
"<img src=""2009669879.jpg"" />","loại trừ, trừ bỏ, ngăn ngừa; đẩy xa;",preclude,/prɪˈkluːd/,<div>a. The horrible rainstorm precluded us from traveling any further.</div><div>b. The unexpected cost of the room precluded a gourmet dinner for the travelers.</div><div><br /></div>
"<img src=""bao gia in to roi.png"" />","(v): trích dẫn; định giá, báo giá; (n): sự trích dẫn, lời trích dẫn, đoạn trích dẫn",quote,/kwəʊt/,<div>a. We were quoted a price of $89 for the room for one night.</div><div>b. Call ahead and get a price quote for a week-long stay.</div><div><br /></div>
"<img src=""paste-61800284422147.jpg"" />","suất, mức, giá (giá được tính theo các nấc căn cứ theo chất lượng), tỷ lệ;",rate,/reɪt/,<div>a. The rate for the hotel room is too high considering how few services are available&nbsp;on-site.</div><div>b. The sign in the lobby lists the seasonal rates.</div><div><br /></div>
"<img src=""paste-61993557950465.jpg"" />","<div>(sự) giữ trước, đặt trước; sự dành riêng, khu vực dành&nbsp;riêng;</div>",reservation,"&nbsp;/,rezə'veiʃn/","<div>a. I know I made a reservation for tonight, but the hotel staff has no record of it in the&nbsp;system.</div><div>b. It is difficult, if not impossible, to get reservations at this hotel at the height of the&nbsp;summer season.</div><div><br /></div>"
"<img src=""customer-service.jpg"" />","(n): dịch vụ, sự phục vụ; (v): phục vụ;",service,/ˈsɜːvɪs/,"<div>a. The hotel has a number of luxury services like the on-site gym, sauna, pool, and&nbsp;beauty salon.</div><div>b. Mr. Rockmont called room service to order a late-night snack.</div><div><br /></div>"
"<img src=""Confirmation-w-AB-Vigneron-800x430.jpg"" />","xác nhận, thừa nhận; chứng thực, phê chuẩn (to validate)",confirm,&nbsp;/kən'fɜ:m/,<div>a. Jorge called the hotel to confirm that he had a room reservation.</div><div>b. We automatically send a postcard to let you know that your travel dates have been&nbsp;confirmed.</div><div><br /></div>
"<img src=""Busy_1380643440871.jpg"" />","bận, bận rộn;",busy,/ˈbɪzi/,"<div>a. Alfred was busy getting ready for his vacation.</div><div>b. The airport was busy, with people catching planes and heading for car rental&nbsp;companies.</div><div><br /></div>"
"<img src=""total-lunar-eclipse-to-coincide-with-winter-solstice-in-almost-400-years2.jpg"" />","trùng khớp, trùng hợp, trùng nhau; xảy ra đồng thời;",coincide,/ˌkəʊɪnˈsaɪd/,"<div>a. My cousin's wedding coincided with a holiday weekend, so it was a perfect time to&nbsp;rent a car and go for a drive.</div><div>b. Sean was hoping that the days for the special discount on car rentals would&nbsp;coincide with his vacation, but they did not.</div><div><br /></div>"
"<img src=""confusion2.jpg"" />","<div>(sự) lộn xộn, hỗn loạn; (sự) mơ hồ, mập mờ;</div><div>(sự) lẫn lộn, nhầm lẫn; (sự) bối rối, xấu hổ</div>",confusion,/kənˈfjuːʒn̩/,"<div>a. There was some confusion about which rental discount coupons applied to which&nbsp;car rental agency.</div><div>b. To avoid any confusion about renting the car, Yolanda asked her travel agent to&nbsp;make the arrangements on her behalf.</div><div><br /></div>"
"<img src=""2012-12-27--17-2-25-919_Contact_Us_1380643440871.jpg"" />","(sự/chỗ) chạm, tiếp xúc, giao tiếp, giao dịch, gặp gỡ;<div>verb : tiếp xúc với, đụng chạm vào, gặp gỡ;</div>",contact,/ˈkɒntækt/,<div>a. Manuel contacted at least a dozen car rental agencies to get the best deal.</div><div>b. Last night I was contacted by my travel agent who said he had found a better price&nbsp;on a car rental.</div><div><br /></div>
"<img src=""disappointed-kid.jpg"" />","<div>(v): thất vọng, chán ngán; nhụt chí, nản lòng; thất hứa, thất&nbsp;ước;</div>",disappoint,/ˌdɪsəˈpɔɪnt/,"<div>a. Leila was disappointed to discover that no rental cars were available the weekend&nbsp;she wished to travel.</div><div>b. I hate to disappoint you, but I can't allow you to rent a car unless you have a major&nbsp;credit card.</div><div><br /></div>"
"<img src=""paste-120319213830147.jpg"" />","định, dự định, có ý định;",intend,/ɪnˈtend/,<div>a. I never intended to drive to Los Angeles until my brother suggested we do it&nbsp;together.</div><div>b. Do you intend to return the car to this location or to another location?</div><div><br /></div>
"<img src=""paste-129583458287619.jpg"" />","<div>sự cho phép, đăng ký; giấy phép, bằng, chứng chỉ (cho phép làm&nbsp;gì đó);</div>",license,/ˈlaɪsns/,"<div>a. First, I'll need to see your driver's license and a major credit card.</div><div>b. You will need a license in order to run this business.</div><div><br /></div>"
"<img src=""7_10_3_tension-type-headache-stress_106135484.jpg"" />","&nbsp;lo lắng, bồn chồn, căng thẳng;",nervous,/ˈnɜːvəs/,"<div>a. As we approached the city Lonnie started driving nervously, so I volunteered to&nbsp;drive that part of the trip.</div><div>b. I looked around nervously the entire time I was in the dark parking garage.</div><div><br /></div>"
"<img src=""385_optional.png-628x250_1380643440871.png"" />","tùy ý, tùy chọn, không bắt buộc;",optional,/ˈɒpʃnəl/,<div>a. Check this box if you wish to have this optional insurance.</div><div>b. Having a driver's license is not optional.</div><div><br /></div>
"<img src=""quan-tai-1.jpg"" />","cám dỗ, khêu gợi, quyến rũ; xúi, xúi giục, kích động;",tempt,/tempt/,<div>a. I am tempted by the idea of driving across the country instead of flying.</div><div>b. Gina is tempted to rent the smaller car to save a few dollars.</div><div><br /></div>
"<img src=""maverick_airtime1.jpg"" />","run lên, rùng mình; rộn lên, rộn ràng; rung cảm, xúc động;",thrill,/θrɪl/,"<div>a. The thought of renting a sports car gave John a thrill.</div><div>b. Just taking a vacation is thrill enough, even if we are driving instead of flying.</div><div><br /></div>"
"<img src=""tier3-screen_1380643440871.png"" />","hạng, tầng, lớp, tầng lớp;",tier,/tɪə/,"<div>a. The car rental company had a few tiers of cars, each one costing more than the&nbsp;previous tier.</div><div>b. If you are on a budget, I suggest you think about renting a car from our lowest tier.</div><div><br /></div>"
"<img src=""give_it_back_by_neverbeendarkmarked-d4s31g2.jpg"" />","sự đạt được, sự giành được; (số nhiều) tài năng, kỹ năng, kiến thức",attainment,/ə'teinmənt/,<div>a. The actress received a lot of attention for her many professional attainments.</div><div>b. The attainment of an Academy Award validates a performer's career.</div><div><br /></div>
"<img src=""400bushel-graintank-R4D015672-1366x768.jpg"" />","kết hợp, phối hợp",combine,/kəmˈbaɪn/,<div>a. The director combined two previously separate visual techniques.</div><div>b. The new production company combines the talents of three of Hollywood's best&nbsp;known teams.</div><div><br /></div>
"<img src=""antinbath-transplant-run-relay2_1380643440871.jpg"" />","tiếp tục, tiếp diễn, làm tiếp, duy trì;",continue,/kənˈtɪnjuː/,<div>a. The film continues the story set out in an earlier film.</div><div>b. The search for a star will continue until one is found.</div><div><br /></div>
"<img src=""260004685_8d78d77db0_z_1380643440871.jpg"" />","(sự) diễn tả, mô tả; diện mạo, hình dạng",description,/dɪˈskrɪpʃn̩/,<div>a. The description of the film did not match what we saw on screen.</div><div>b. The critic's description of the film made it sound very appealing.</div><div><br /></div>
"<img src=""urban-disperse_1380643440871.jpg"" />","giải tán, xua tan; gieo rắc, truyền (tin đồn);",disperse,/dɪˈspɜːs/,<div>a. The reporters dispersed after the press agent cancelled the interview with the film&nbsp;director.</div><div>b. The crowd outside the movie premiere would not disperse until they had seen the&nbsp;movie stars.</div><div><br /></div>
"<img src=""jiggy_header_entertainment.jpg"" />","sự giải trí, tiêu khiển",entertainment,/ˌentəˈteɪnmənt/,<div>a. The movie was provided for our entertainment.</div><div>b. There was not entertainment for children of guests at the hotel.</div><div><br /></div>
"<img src=""paste-29214367547395.jpg"" />","ảnh hưởng đến, tác động đến, khiến cho;",influence,/ˈɪnflʊəns/,<div>a. The editor's style influenced a generation of film editors.</div><div>b. The producer was able to influence the town council to allow her to film in the&nbsp;park.</div><div><br /></div>
"<img src=""maxresdefault (2).jpg"" />","dải,&nbsp;vùng, phạm vi, lĩnh vực, tầm (scope);",range,/reɪndʒ/,<div>a. The range of the director's vision is impressive.</div><div>b. What is the price range you are willing pay for a ticket to the premiere?</div><div><br /></div>
"<img src=""logo_publish_today_1380643440871.jpg"" />","phát hành; thả, phóng thích, giải thoát; làm nhẹ, làm bớt (đau);",release,/rɪˈliːs/,<div>a. The film was finally realeased to movie theaters after many delays.</div><div>b. The producers of the film are hoping to release it in time for the holidays.</div><div><br /></div>
"<img src=""paste-65030099828737.jpg"" />","<div>đại diện, thay mặt; tiêu biểu, tượng trưng; diễn tả,&nbsp;đóng vai;</div>",representation,"/,reprizen'teiʃn/",<div>a. The actor's representation of his character did not seem authentic.</div><div>b. The film's representation of world poverty through the character of the hungry&nbsp;child was quite moving.</div><div><br /></div>
"<img src=""Why-You-Should-Separate-Your-Shopping-Cart-from-Your-CMS-.jpg"" />","tách rời, riêng rẽ;",separately,&nbsp;/'seprətli/,<div>a. Each scene of the movie was filmed separately from the others.</div><div>b. The theater was very crowded so we had to sit separately.</div><div><br /></div>
"<img src=""20100408_df1_20100305_1232_194-196 kestrel in flight (arbitrary successive frame montage)(r+mb id@768).jpg"" />","kế tiếp, liên tiếp, liên tục; lần lượt",successive,/səkˈsesɪv/,<div>a. The script went through successive rewrites.</div><div>b. Somehow the successive images were interrupted and had to be edited again.</div><div><br /></div>
"<img src=""actors_1380643440871.jpg"" />","<div>(sự/cách) hành động, hoạt động, làm việc; chuỗi sự kiện (truyện,&nbsp;sân khấu);</div>",action,/ˈæktɪŋ/,<div>a. The director decided that the second act needed more action and asked the&nbsp;playwright to review the work.</div><div>b. The action on stage was spellbinding.</div><div><br /></div>
"<img src=""1001-cach-tiep-can-va-lam-quen-ban-gai.jpg"" />","<div>tiến gần, tiếp cận; đường tiến vào, lối vào; thăm dò, tiếp&nbsp;xúc;</div>",approach,/əˈprəʊtʃ/,<div>a. The performance approaches perfection.</div><div>b. The director approached the play from unusual angle.</div><div><br /></div>
"<img src=""become-more-approachable_1380643440871.jpg"" />","có thể đến gần, tới gần được, thân thiện, dễ tiếp cận;",approachable,/əˈprəʊtʃəbl̩/,a.&nbsp;Malcolm is always very approachable – talk it over with him.<div>b.&nbsp;Graham's always very approachable - why don't you talk the problem over with him?</div>
"<img src=""Audience.jpg"" />","khán giả, thính giả, độc giả;",audience,/ˈɔːdiəns/,<div>a. The audience cheered the actors as they walked off the stage.</div><div>b. The playwright expanded his audience by writing for film as well as for stage.</div><div><br /></div>
"<img src=""depositphotos_2518984-Create-a-graph.jpg"" />",sáng tạo;,creative,/kri:'eitiv/,<div>a. The writer's creative representation of the Seven Deadly Sins was astounding.</div><div>b. There are a number of creative people writing for the theater these days.</div><div><br /></div>
"<img src=""Chat.jpg"" />",(n): cuộc đối thoại; (v): đối thoại;,dialogue,/ˈdaɪəlɒɡ/,"<div>a. The actors performed the dialogue without using scripts.</div><div>b. The written dialogue seemed great, but was hard to perform.</div><div><br /></div>"
"<img src=""table.gif"" />","yếu tố, nhân tố, nguyên tố;",element,/ˈelɪmənt/,"<div>a. The audience is an essential element of live theater.</div><div>b. By putting togetther all the elements of theater into one play, he overwhelmed the&nbsp;critics.</div><div><br /></div>"
"<img src=""the-human-experience.jpg"" />","kinh nghiệm, trải qua",experience,/ɪkˈspɪərɪəns/,a. The experience of live theater is very thrilling.&nbsp;<div>b. Going to the theater was not part of Claude's experience growing up.</div><div><br /></div>
"<img src=""Tornado-at-Union-City-Oklahoma-Credit-NOAA-Photo-Library.jpg"" />","xuất hiện; xảy ra, xảy đến;",occur,/ə'kɜː/,<div>a. The murder in the play occurs in the second act.</div><div>b. It never occurred to me that the wife whom the character referred to was&nbsp;imaginary.</div><div><br /></div>
"<img src=""The-North-Carolina-Tar-Heels-cheerleaders-perform.jpg"" />","thực hiện, thi hành; trình bày, biểu diễn, đóng vai;",perform,/pəˈfɔːm/,<div>a. The theater group performed a three-act play.</div><div>b. Juan performed the role without forgetting any lines.</div><div><br /></div>
"<img src=""131993068_11n.jpg"" />","nhắc lại, kể lại; diễn tập (kịch, múa...);",rehearse,/rɪˈhɜːs/,<div>a. The players rehearsed for only three weeks before the show opened.</div><div>b. The director rehearses with the actors ten hours each day.</div><div><br /></div>
"<img src=""9807_1380643440871.jpg"" />","Sự phê bình, lời phê bình, duyệt, xem lại;",review,/rɪˈvjuː/,<div>a. The critic's influential review of the play was so negative that it sank the entire&nbsp;production.</div><div>b. The newspaper sent a rank amateur to review the play.</div><div><br /></div>
"<img src=""17218.jpg"" />","bán hết, bán sạch (vé);&nbsp;bán rẻ hết, bán tống bán tháo;&nbsp;",sell out,/səʊld aʊt/,<div>a. The Broadway opening sold out months in advance.</div><div>b. We expect that this play will be a smash and sell out quickly.</div><div><br /></div>
"<img src=""free-wi-fi-1000x936.jpg"" />","sẵn có, sẵn sàng (để dùng, để phục vụ);",available,/əˈveɪləbl̩/,"<div>a. In order to understand all the words to the opera, Sue Lin kept an Italian dictionary&nbsp;available at all times.</div><div>b. I checked the list of available compact discs before ordering.</div><div><br /></div>"
"<img src=""AAEAAQAAAAAAAAZ5AAAAJDYyNWUwZjhjLWUwOTUtNDYyMC1hZDJmLWE2NjZiMDAzNzk3Zg.jpg"" />","mở rộng, nới rộng;",broaden,/'brɔ:dn/,<div>a. Dominique wants to broaden her knowledge of opera history.</div><div>b. You will appreciate music more if you broaden your tastes and listen to several&nbsp;types of music.</div><div><br /></div>
"<img src=""sach-large_1380643440871.jpg"" />","hạng, loại",category,/ˈkætɪɡəri/,<div>a. Jazz is one of many categories of music.</div><div>b. The works of Mozart are in a category by themselves.</div><div><br /></div>
"<img src=""disparate_youth_by_likelucy-d536ozk_1380643440871.jpg"" />","khác biệt, khác loại, khác hẳn nhau;",disparate,/ˈdɪspərət/,"<div>a. In the song, the disparate voices hauntingly join a blended chorus.</div><div>b. Religious song cut across disparate categories of music.</div><div><br /></div>"
"<img src=""paste-50315541872643.jpg"" />","chia ra, phân chia; chia rẽ, ly gián;",divide,/dɪˈvaɪd/,"<div>a. The music class was evenly divided between those who liked country and western&nbsp;music and those who do not.</div><div>b. The broad topic of music can be divided into manageable parts, such as themes,&nbsp;styles, or centuries.</div><div><br /></div>"
"<img src=""1344572471-babauan-babau-eva2.jpg"" />","chiếu cố, thiên vị; thích, thiện cảm;",favor,/'feivə/,<div>a. Sam enjoys the works of several composers but he tends to favor Mozart.</div><div>b. I'd favor an evening at a jazz concert over an evening at the opera any time.</div><div><br /></div>
"<img src=""paste-75797582839811 (1).jpg"" />","bản năng; năng khiếu, thiên hướng;",instinct,/ˌɪnˈstɪŋkt/,"<div>a. The student's ability to play the cello was so natural, it seemed an instinct.</div><div>b. The music lover followed his instincts and collected only music that he enjoyed.&nbsp;</div><div><br /></div>"
"<img src=""355_1380643440871.png"" />","ưa thích hơn, thích cái gì hơn",prefer,/pri'fɜ:/,<div>a. He preferred contemporary music to any other type.</div><div>b. Ms. Lanet prefers to get a seat near the aisle when she attends a concert.</div><div><br /></div>
"<img src=""why-clipart.jpg"" />","(n): lý do, lý lẽ; lý trí, lẽ phải; (v): suy luận, lý luận; tranh luận, cãi lý;",reason,/ˈriːzən/,<div>a. We'll never understand the reason why some music is popular and some is not.</div><div>b. There is every reason to believe that Beethoven will still be popular in the next&nbsp;century.</div><div><br /></div>
"<img src=""paste-88849988452353.jpg"" />","thư giãn, sự nghỉ ngơi, sự giải trí",relaxation,/ˌriːlækˈseɪʃn̩/,<div>a. Listening to soothing music before bedtime provides good relaxation.</div><div>b. He played the piano for relaxation and pleasure.</div><div><br /></div>
"<img src=""paste-101734890340355.jpg"" />","sở thích,thị hiếu, vị giác;",taste,/teɪst/,<div>a. Ella had the taste required to select a musical program for the visiting dignitaries.</div><div>b. This music does not appeal to my tastes; but I'm not old-fashioned.</div><div><br /></div>
"<img src=""Có-nên-nài-nỉ-khách-hàng-1024x576.png"" />","&nbsp;thúc giục, thúc đẩy, thôi thúc; cố nài, cố thuyết phục;",urge,/ɜːdʒ/,"<div>a. His mother urged him to study the piano; the rest is musical history.</div><div>b. Despite my reluctance, my friends urged me to attend an opera.</div><div><br /></div>"
"<img src=""7143_watermark1.jpg"" />","đạt được, thu được, giành được, kiếm được (obtain);",acquire,/əˈkwaɪə/,<div>a. The museum acquired a Van Gogh during heavy bidding.</div><div>b. The sculptor acquired metalworking skills after much practice.</div><div><br /></div>
"<img src=""1da1ceb7-6fdf-4389-8476-a7702a36ed75_1380643440871.jpg"" />","khâm phục, thán phục; hâm mộ, ngưỡng mộ;",admire,/ədˈmaɪə/,"<div>a. Raisa, admiring the famous smile, stood before the Mona Lisa for hours.</div><div>b. I admire all the effort the museum put into organizing this wonderful exhibit.</div><div><br /></div>"
"<img src=""World Famous Beer Collection.JPG"" />","<div>(sự) sưu tầm, thu thập; (sự/tiền) quyên góp; nhóm người/đồ&nbsp;vật</div>",collection,/kəˈlekʃn̩/,<div>a. The museum's collection contained many works donated by famous collectors.</div><div>b. The museum's collection kept two full-time curators busy.</div><div><br /></div>
"<img src=""Handling-Criticism.jpg"" />","(sự/lời) phê bình, chỉ trích, phê phán, bình phẩm",criticism,/ˈkrɪtɪsɪzəm/,"<div>a. According to the criticism of the Victorian era, the painting was a masterpiece; now&nbsp;it is considered merely a minor work.</div><div>b. The revered artist's criticism of the piece was particularly insightful.</div><div><br /></div>"
